{
  "version": 1,
  "command": "change-report",
  "ok": true,
  "identity_scheme": "nauqtype.semantic.v1",
  "before": { "module": "main", "evidence": "checked" },
  "after": { "module": "main", "evidence": "checked" },
  "evidence": {
    "review": "checked",
    "comparison": "semantic-identities",
    "policy": "checked",
    "propagation": "checked"
  },
  "summary": {
    "added_functions": 2,
    "removed_functions": 0,
    "changed_functions": 2,
    "added_call_edges": 8,
    "removed_call_edges": 0,
    "added_propagates": 2,
    "removed_propagates": 0,
    "policy_targets": 5,
    "policy_errors": 0,
    "diagnostics": 0
  },
  "changes": {
    "added_functions": [
      "fn:helper::boost",
      "fn:helper::load_text"
    ],
    "removed_functions": [],
    "changed_functions": [
      "fn:main::score",
      "fn:main::main"
    ],
    "added_call_edges": [
      "fn:helper::load_text -> builtin:read_file",
      "fn:helper::load_text -> builtin-variant:Ok",
      "fn:main::score -> fn:helper::load_text",
      "fn:main::score -> builtin:str_len",
      "fn:main::score -> fn:helper::boost",
      "fn:main::score -> builtin:list_len",
      "fn:main::score -> builtin:list_get",
      "fn:main::score -> variant:helper::Choice::Use"
    ],
    "removed_call_edges": [],
    "added_propagates": [
      "fn:helper::load_text -> io_err",
      "fn:main::score -> io_err"
    ],
    "removed_propagates": []
  },
  "policy": {
    "provided": true,
    "path": "tests/fixtures/evidence_parity/policy.json",
    "targets": 5,
    "errors": 0,
    "malformed": false
  },
  "diagnostics": [
  ]
}
