{
  "version": 1,
  "command": "change-report",
  "ok": true,
  "identity_scheme": "nauqtype.semantic.v1",
  "before": { "module": "main", "evidence": "checked" },
  "after": { "module": "main", "evidence": "checked" },
  "evidence": {
    "review": "checked",
    "comparison": "semantic-identities",
    "policy": "not-provided",
    "propagation": "checked"
  },
  "summary": {
    "added_functions": 0,
    "removed_functions": 0,
    "changed_functions": 2,
    "added_call_edges": 2,
    "removed_call_edges": 0,
    "added_propagates": 0,
    "removed_propagates": 0,
    "policy_targets": 0,
    "policy_errors": 0,
    "diagnostics": 0
  },
  "changes": {
    "added_functions": [],
    "removed_functions": [],
    "changed_functions": [
      "fn:main::helper",
      "fn:main::main"
    ],
    "added_call_edges": [
      "fn:main::helper -> builtin:print_line",
      "fn:main::main -> fn:main::helper"
    ],
    "removed_call_edges": [],
    "added_propagates": [],
    "removed_propagates": []
  },
  "policy": {
    "provided": false,
    "path": "",
    "targets": 0,
    "errors": 0,
    "malformed": false
  },
  "diagnostics": [
  ]
}
